{"schema_version":"0.2-draft","series_id":"SERIES-V02-TEMPLATE","session_id":"AEON-SESSION-TEMPLATE","participant_id":"PSEUDONYM-ONLY","protocol_id":"pg01-geometric-regularity","started_at":"2026-01-01T00:00:00Z","observations":[],"engine_records":[],"derived_metrics":[],"behavioral_records":[{"schema_version":"0.2-draft","record_id":"pg01-record-0001","probe_id":"pg01-geometric-regularity","trial_id":"pg01-trial-0001","response_status":"answered","choice_id":"left","reaction_time_ms":842,"recorded_at":"2026-09-14T00:00:01Z","timing_point":"response","provenance":{"runtime_id":"aeon-measurement-reference","runtime_version":"0.1","clock_source":"performance.now","input_modality":"keyboard"},"timing_trace":{"stimulus_onset_ms":1000,"response_ms":1842},"display_context":{"width_px":1440,"height_px":900,"device_pixel_ratio":1},"operational_authority":false,"integrity":{"perceptual_stimulus_integrity":"VALID","response_input_integrity":"VALID","timing_integrity":"VALID","reasons":[]},"evidence_role":"behavioral_measured"}],"interpretation_boundary":"Behavioral records describe observed choices and timing; they do not diagnose, establish causality, or prove symbolic constructs."}